{"schema_version":"fde-trial-001-runtime/0.1.0-rc","case_id":"FDE-TRIAL-001","fixture_version":"0.1.0-rc","message_type":"ACTION_OUTCOME","payload":{"event_id":"fde-action-001","human_decision_event_id":"fde-human-001","correlation_id":"fde-correlation-001","outcome":"ACTION_RECEIPT","action_type":"SIMULATE_REFUND_POLICY_CHANGE","target_ref":"synthetic://fde-trial-001/order/001","action_idempotency_key":"fde-action-key-001","input_sha256":"0000000000000000000000000000000000000000000000000000000000000000","result_sha256":"1111111111111111111111111111111111111111111111111111111111111111","receipt":{"action_id":"fde-fake-action-001","outcome":"SIMULATED"},"occurred_at":"2026-09-11T00:02:00Z"}}
