{"schema_version":"fde-trial-001-runtime/0.1.0-rc","case_id":"FDE-TRIAL-001","fixture_version":"0.1.0-rc","message_type":"ENGINE_PRE_ACTION_AUDIT","payload":{"event_id":"fde-audit-001","request_id":"fde-request-001","correlation_id":"fde-correlation-001","knowledge_snapshot_ref":"synthetic://fde-trial-001/kg/refund-policy/2.0-proposed","engine_input":{"request_id":"fde-request-001"},"engine_input_sha256":"AAAAAAAAAAAAAAAAAAAAAAAAAAAAAAAAAAAAAAAAAAAAAAAAAAAAAAAAAAAAAAAA","engine_result":{"request_id":"fde-request-001","generation":"GEN2","decision":"REVIEW_REQUIRED","verification_status":"FIXTURE_EXPECTATION_ONLY","hard_gate":"FAIL","real_action_allowed":false,"result_digest":"BBBBBBBBBBBBBBBBBBBBBBBBBBBBBBBBBBBBBBBBBBBBBBBBBBBBBBBBBBBBBBBB","original_engine_result_digest":"BBBBBBBBBBBBBBBBBBBBBBBBBBBBBBBBBBBBBBBBBBBBBBBBBBBBBBBBBBBBBBBB"},"engine_result_sha256":"CCCCCCCCCCCCCCCCCCCCCCCCCCCCCCCCCCCCCCCCCCCCCCCCCCCCCCCCCCCCCCCC","original_engine_result_sha256":"CCCCCCCCCCCCCCCCCCCCCCCCCCCCCCCCCCCCCCCCCCCCCCCCCCCCCCCCCCCCCCCC","occurred_at":"2026-09-11T00:00:00Z"}}
