{"schema_version":"fde-trial-001-runtime/0.1.0-rc","case_id":"FDE-TRIAL-001","fixture_version":"0.1.0-rc","message_type":"ACTION_RECONCILIATION_RESULT","payload":{"query_id":"fde-query-001","correlation_id":"fde-correlation-001","action_idempotency_key":"fde-action-key-001","status":"FOUND","receipt":{"action_id":"fde-fake-action-001","outcome":"SIMULATED"},"retry_allowed":false,"resolved_at":"2026-09-11T00:04:00Z"}}
