{"schema_version":"fde-trial-001-runtime/0.1.0-rc","case_id":"FDE-TRIAL-001","fixture_version":"0.1.0-rc","message_type":"HUMAN_DECISION","payload":{"event_id":"fde-human-001","engine_audit_event_id":"fde-audit-001","correlation_id":"fde-correlation-001","knowledge_snapshot_ref":"synthetic://fde-trial-001/kg/refund-policy/2.0-proposed","policy_id":"refund-policy","policy_version":"2.0-proposed","decision":"APPROVE","resulting_snapshot_state":"ACTIVE","actor_id":"synthetic-refund-policy-owner-001","authority_ref":"synthetic://fde-trial-001/authority/refund-policy-owner/001","authority_scope":["APPROVE_POLICY_ACTIVATION","AUTHORIZE_LOCAL_FAKE_ACTION"],"authority_issued_at":"2026-09-10T00:00:00Z","authority_expires_at":"2026-09-12T00:00:00Z","occurred_at":"2026-09-11T00:01:00Z"}}
